{
  "targets": [
    "T01",
    "T02",
    "T03"
  ],
  "radars": [
    "R01",
    "R02"
  ],
  "missile_vehicles": [
    "V01",
    "V02"
  ],
  "interception_attempts_by_target": {
    "T01": [
      "K01",
      "K02"
    ],
    "T02": [
      "K01",
      "K02"
    ],
    "T03": [
      "K01",
      "K02"
    ]
  },
  "time_slots": [
    "H01",
    "H02",
    "H03",
    "H04",
    "H05",
    "H06",
    "H07",
    "H08"
  ],
  "target_value": {
    "T01": 29,
    "T02": 33,
    "T03": 37
  },
  "target_max_interception_count": {
    "T01": 2,
    "T02": 2,
    "T03": 2
  },
  "missile_vehicle_load": {
    "V01": 4,
    "V02": 3
  },
  "missile_vehicle_cost": {
    "V01": 4,
    "V02": 5
  },
  "radar_detection_feasibility": {
    "T01": {
      "R01": {
        "H01": 1,
        "H02": 1,
        "H03": 0,
        "H04": 1,
        "H05": 1,
        "H06": 1,
        "H07": 1,
        "H08": 0
      },
      "R02": {
        "H01": 1,
        "H02": 0,
        "H03": 1,
        "H04": 1,
        "H05": 1,
        "H06": 1,
        "H07": 0,
        "H08": 1
      }
    },
    "T02": {
      "R01": {
        "H01": 1,
        "H02": 0,
        "H03": 1,
        "H04": 1,
        "H05": 1,
        "H06": 1,
        "H07": 0,
        "H08": 1
      },
      "R02": {
        "H01": 0,
        "H02": 1,
        "H03": 1,
        "H04": 1,
        "H05": 1,
        "H06": 0,
        "H07": 1,
        "H08": 1
      }
    },
    "T03": {
      "R01": {
        "H01": 0,
        "H02": 1,
        "H03": 1,
        "H04": 1,
        "H05": 1,
        "H06": 0,
        "H07": 1,
        "H08": 1
      },
      "R02": {
        "H01": 1,
        "H02": 1,
        "H03": 1,
        "H04": 1,
        "H05": 0,
        "H06": 1,
        "H07": 1,
        "H08": 1
      }
    }
  },
  "radar_channel_capacity": {
    "R01": 1,
    "R02": 1
  },
  "radar_channel_requirement": 1,
  "radar_accuracy_factor": {
    "T01": {
      "R01": {
        "H01": 0.695,
        "H02": 0.72,
        "H03": 0.745,
        "H04": 0.77,
        "H05": 0.795,
        "H06": 0.82,
        "H07": 0.62,
        "H08": 0.645
      },
      "R02": {
        "H01": 0.72,
        "H02": 0.745,
        "H03": 0.77,
        "H04": 0.795,
        "H05": 0.82,
        "H06": 0.62,
        "H07": 0.645,
        "H08": 0.67
      }
    },
    "T02": {
      "R01": {
        "H01": 0.72,
        "H02": 0.745,
        "H03": 0.77,
        "H04": 0.795,
        "H05": 0.82,
        "H06": 0.62,
        "H07": 0.645,
        "H08": 0.67
      },
      "R02": {
        "H01": 0.745,
        "H02": 0.77,
        "H03": 0.795,
        "H04": 0.82,
        "H05": 0.62,
        "H06": 0.645,
        "H07": 0.67,
        "H08": 0.695
      }
    },
    "T03": {
      "R01": {
        "H01": 0.745,
        "H02": 0.77,
        "H03": 0.795,
        "H04": 0.82,
        "H05": 0.62,
        "H06": 0.645,
        "H07": 0.67,
        "H08": 0.695
      },
      "R02": {
        "H01": 0.77,
        "H02": 0.795,
        "H03": 0.82,
        "H04": 0.62,
        "H05": 0.645,
        "H06": 0.67,
        "H07": 0.695,
        "H08": 0.72
      }
    }
  },
  "missile_engagement_feasibility": {
    "T01": {
      "V01": {
        "H01": 1,
        "H02": 1,
        "H03": 0,
        "H04": 1,
        "H05": 1,
        "H06": 1,
        "H07": 1,
        "H08": 1
      },
      "V02": {
        "H01": 1,
        "H02": 0,
        "H03": 1,
        "H04": 1,
        "H05": 1,
        "H06": 1,
        "H07": 1,
        "H08": 0
      }
    },
    "T02": {
      "V01": {
        "H01": 0,
        "H02": 1,
        "H03": 1,
        "H04": 1,
        "H05": 1,
        "H06": 1,
        "H07": 0,
        "H08": 1
      },
      "V02": {
        "H01": 1,
        "H02": 1,
        "H03": 1,
        "H04": 1,
        "H05": 1,
        "H06": 0,
        "H07": 1,
        "H08": 1
      }
    },
    "T03": {
      "V01": {
        "H01": 1,
        "H02": 1,
        "H03": 1,
        "H04": 1,
        "H05": 0,
        "H06": 1,
        "H07": 1,
        "H08": 1
      },
      "V02": {
        "H01": 1,
        "H02": 1,
        "H03": 1,
        "H04": 0,
        "H05": 1,
        "H06": 1,
        "H07": 1,
        "H08": 1
      }
    }
  },
  "interception_probability_table_or_generation_inputs": {
    "T01": {
      "K01": {
        "V01": {
          "R01": {
            "H01": 0.5004,
            "H02": 0.5184,
            "H03": 0.0,
            "H04": 0.5544,
            "H05": 0.5724,
            "H06": 0.5904,
            "H07": 0.4464,
            "H08": 0.4644
          },
          "R02": {
            "H01": 0.5184,
            "H02": 0.5364,
            "H03": 0.0,
            "H04": 0.5724,
            "H05": 0.5904,
            "H06": 0.4464,
            "H07": 0.4644,
            "H08": 0.4824
          }
        },
        "V02": {
          "R01": {
            "H01": 0.5004,
            "H02": 0.0,
            "H03": 0.5364,
            "H04": 0.5544,
            "H05": 0.5724,
            "H06": 0.5904,
            "H07": 0.4464,
            "H08": 0.0
          },
          "R02": {
            "H01": 0.5184,
            "H02": 0.0,
            "H03": 0.5544,
            "H04": 0.5724,
            "H05": 0.5904,
            "H06": 0.4464,
            "H07": 0.4644,
            "H08": 0.0
          }
        }
      },
      "K02": {
        "V01": {
          "R01": {
            "H01": 0.5004,
            "H02": 0.5184,
            "H03": 0.0,
            "H04": 0.5544,
            "H05": 0.5724,
            "H06": 0.5904,
            "H07": 0.4464,
            "H08": 0.4644
          },
          "R02": {
            "H01": 0.5184,
            "H02": 0.5364,
            "H03": 0.0,
            "H04": 0.5724,
            "H05": 0.5904,
            "H06": 0.4464,
            "H07": 0.4644,
            "H08": 0.4824
          }
        },
        "V02": {
          "R01": {
            "H01": 0.5004,
            "H02": 0.0,
            "H03": 0.5364,
            "H04": 0.5544,
            "H05": 0.5724,
            "H06": 0.5904,
            "H07": 0.4464,
            "H08": 0.0
          },
          "R02": {
            "H01": 0.5184,
            "H02": 0.0,
            "H03": 0.5544,
            "H04": 0.5724,
            "H05": 0.5904,
            "H06": 0.4464,
            "H07": 0.4644,
            "H08": 0.0
          }
        }
      }
    },
    "T02": {
      "K01": {
        "V01": {
          "R01": {
            "H01": 0.0,
            "H02": 0.5364,
            "H03": 0.5544,
            "H04": 0.5724,
            "H05": 0.5904,
            "H06": 0.4464,
            "H07": 0.0,
            "H08": 0.4824
          },
          "R02": {
            "H01": 0.0,
            "H02": 0.5544,
            "H03": 0.5724,
            "H04": 0.5904,
            "H05": 0.4464,
            "H06": 0.4644,
            "H07": 0.0,
            "H08": 0.5004
          }
        },
        "V02": {
          "R01": {
            "H01": 0.5184,
            "H02": 0.5364,
            "H03": 0.5544,
            "H04": 0.5724,
            "H05": 0.5904,
            "H06": 0.0,
            "H07": 0.4644,
            "H08": 0.4824
          },
          "R02": {
            "H01": 0.5364,
            "H02": 0.5544,
            "H03": 0.5724,
            "H04": 0.5904,
            "H05": 0.4464,
            "H06": 0.0,
            "H07": 0.4824,
            "H08": 0.5004
          }
        }
      },
      "K02": {
        "V01": {
          "R01": {
            "H01": 0.0,
            "H02": 0.5364,
            "H03": 0.5544,
            "H04": 0.5724,
            "H05": 0.5904,
            "H06": 0.4464,
            "H07": 0.0,
            "H08": 0.4824
          },
          "R02": {
            "H01": 0.0,
            "H02": 0.5544,
            "H03": 0.5724,
            "H04": 0.5904,
            "H05": 0.4464,
            "H06": 0.4644,
            "H07": 0.0,
            "H08": 0.5004
          }
        },
        "V02": {
          "R01": {
            "H01": 0.5184,
            "H02": 0.5364,
            "H03": 0.5544,
            "H04": 0.5724,
            "H05": 0.5904,
            "H06": 0.0,
            "H07": 0.4644,
            "H08": 0.4824
          },
          "R02": {
            "H01": 0.5364,
            "H02": 0.5544,
            "H03": 0.5724,
            "H04": 0.5904,
            "H05": 0.4464,
            "H06": 0.0,
            "H07": 0.4824,
            "H08": 0.5004
          }
        }
      }
    },
    "T03": {
      "K01": {
        "V01": {
          "R01": {
            "H01": 0.5364,
            "H02": 0.5544,
            "H03": 0.5724,
            "H04": 0.5904,
            "H05": 0.0,
            "H06": 0.4644,
            "H07": 0.4824,
            "H08": 0.5004
          },
          "R02": {
            "H01": 0.5544,
            "H02": 0.5724,
            "H03": 0.5904,
            "H04": 0.4464,
            "H05": 0.0,
            "H06": 0.4824,
            "H07": 0.5004,
            "H08": 0.5184
          }
        },
        "V02": {
          "R01": {
            "H01": 0.5364,
            "H02": 0.5544,
            "H03": 0.5724,
            "H04": 0.0,
            "H05": 0.4464,
            "H06": 0.4644,
            "H07": 0.4824,
            "H08": 0.5004
          },
          "R02": {
            "H01": 0.5544,
            "H02": 0.5724,
            "H03": 0.5904,
            "H04": 0.0,
            "H05": 0.4644,
            "H06": 0.4824,
            "H07": 0.5004,
            "H08": 0.5184
          }
        }
      },
      "K02": {
        "V01": {
          "R01": {
            "H01": 0.5364,
            "H02": 0.5544,
            "H03": 0.5724,
            "H04": 0.5904,
            "H05": 0.0,
            "H06": 0.4644,
            "H07": 0.4824,
            "H08": 0.5004
          },
          "R02": {
            "H01": 0.5544,
            "H02": 0.5724,
            "H03": 0.5904,